{
  "$schema": "https://json-schema.org/draft/2020-12/schema",
  "$id": "https://aavistin.example/schemas/package.schema.json",
  "title": "Requirement package",
  "description": "See docs/architecture.md, \"Requirement sources\", for the field semantics.",
  "type": "object",
  "required": ["source", "type", "jurisdiction", "version", "questions", "scope"],
  "additionalProperties": false,
  "properties": {
    "source": {
      "type": "string",
      "pattern": "^[a-z0-9]+(-[a-z0-9]+)*$",
      "description": "Namespaced package id, e.g. eu-cra, demo-widget-safety."
    },
    "type": {
      "type": "string",
      "enum": ["legislation", "harmonised_standard", "qms", "customer", "guidance"]
    },
    "jurisdiction": {
      "type": "string",
      "description": "Matched against TargetMarket.code, e.g. EU, US, UK."
    },
    "version": {
      "type": "string",
      "description": "e.g. 2024-2847@2026-09"
    },
    "title": { "type": "string" },
    "legal_sources": {
      "type": "array",
      "items": {
        "type": "object",
        "additionalProperties": false,
        "properties": {
          "celex": { "type": "string" },
          "eli": { "type": "string" },
          "citation": { "type": "string" }
        }
      },
      "default": []
    },
    "dates_of_application": {
      "type": "object",
      "additionalProperties": false,
      "properties": {
        "from": { "type": "string", "format": "date" },
        "until": { "type": "string", "format": "date" }
      }
    },
    "supersedes": {
      "type": "array",
      "items": { "$ref": "#/$defs/packageRef" },
      "default": []
    },
    "amends": {
      "type": "array",
      "items": { "$ref": "#/$defs/packageRef" },
      "default": []
    },
    "redistributable": {
      "type": "boolean",
      "default": true,
      "description": "False for content (e.g. standards clause summaries) with restricted redistribution."
    },
    "uses": {
      "type": "array",
      "items": { "type": "string", "pattern": "^[a-z][a-z0-9-]*:[a-z][a-z0-9_]*$" },
      "description": "Shared library questions this package relies on, as 'question-set-source:question_id'."
    },
    "question_groups": {
      "type": "array",
      "description": "Optional ordered topics for the questionnaire. Each lists question ids (declared here or taken from 'uses') in display order; ungrouped questions are shown last (ADR 0025).",
      "items": {
        "type": "object",
        "required": ["id", "title", "questions"],
        "additionalProperties": false,
        "properties": {
          "id": { "type": "string", "pattern": "^[a-z][a-z0-9_]*$" },
          "title": { "type": "string", "minLength": 1 },
          "questions": {
            "type": "array",
            "items": { "type": "string", "pattern": "^[a-z][a-z0-9_]*$" }
          }
        }
      }
    },
    "questions": {
      "type": "array",
      "items": { "$ref": "#/$defs/question" }
    },
    "scope": { "$ref": "#/$defs/scope" },
    "role": {
      "$ref": "#/$defs/expression",
      "description": "Expression yielding the economic operator role for a configuration; requirements are filtered by it (ADR 0019)."
    },
    "classifications": {
      "type": "array",
      "items": { "$ref": "#/$defs/classification" },
      "default": []
    },
    "requirements": {
      "type": "array",
      "items": { "$ref": "#/$defs/requirement" },
      "default": []
    },
    "assessment_routes": {
      "type": "array",
      "items": { "$ref": "#/$defs/assessmentRoute" },
      "default": []
    },
    "finding_rules": {
      "type": "array",
      "items": { "$ref": "#/$defs/findingRule" },
      "default": []
    },
    "fixtures": {
      "type": "array",
      "items": { "$ref": "#/$defs/fixture" },
      "default": []
    }
  },
  "$defs": {
    "packageRef": {
      "type": "object",
      "required": ["source", "version"],
      "additionalProperties": false,
      "properties": {
        "source": { "type": "string" },
        "version": { "type": "string" }
      }
    },
    "question": {
      "type": "object",
      "required": ["id", "type", "level"],
      "additionalProperties": false,
      "properties": {
        "id": { "type": "string", "pattern": "^[a-z][a-z0-9_]*$" },
        "type": { "type": "string", "enum": ["boolean", "choice", "number", "date"] },
        "level": {
          "type": "string",
          "enum": ["product", "hardware", "software", "option"]
        },
        "label": { "type": "string" },
        "unit": { "type": "string" },
        "choices": {
          "type": "array",
          "items": { "type": "string" }
        },
        "condition": { "$ref": "#/$defs/expression" },
        "implied_by": { "$ref": "#/$defs/impliedBy" },
        "guidance": {
          "type": "string",
          "description": "Plain text shown to the user before they answer, e.g. how to assess the question themselves. Our own summary only -- never standards/legal text verbatim."
        },
        "guidance_url": {
          "type": "string",
          "format": "uri",
          "description": "Optional link to an authoritative source for further reading."
        },
        "carry_forward": {
          "type": "boolean",
          "default": true,
          "description": "False for questions about one release's change: a new release starts them unanswered (ADR 0021)."
        }
      },
      "allOf": [
        {
          "if": { "properties": { "type": { "const": "choice" } } },
          "then": { "required": ["choices"] }
        }
      ]
    },
    "impliedBy": {
      "type": "object",
      "required": ["when", "value"],
      "additionalProperties": false,
      "description": "Derives the question's value when no explicit answer exists: if 'when' is truthy the value is 'value'.",
      "properties": {
        "when": { "$ref": "#/$defs/expression" },
        "value": {}
      }
    },
    "expression": {
      "description": "A JSONLogic-subset expression; see apps/packages/ruleengine.py for the supported operators.",
      "type": ["object", "boolean"]
    },
    "scope": {
      "type": "object",
      "required": ["include"],
      "additionalProperties": false,
      "properties": {
        "include": { "$ref": "#/$defs/expression" },
        "exclude": {
          "type": "array",
          "items": { "$ref": "#/$defs/scopeExclusion" },
          "default": []
        }
      }
    },
    "scopeExclusion": {
      "type": "object",
      "required": ["id", "when", "ref"],
      "additionalProperties": false,
      "properties": {
        "id": { "type": "string" },
        "when": { "$ref": "#/$defs/expression" },
        "ref": { "type": "string", "description": "Legal reference, e.g. Art. 2(2)" }
      }
    },
    "classification": {
      "type": "object",
      "required": ["id", "label"],
      "additionalProperties": false,
      "properties": {
        "id": { "type": "string" },
        "label": { "type": "string" },
        "when": { "$ref": "#/$defs/expression" }
      }
    },
    "requirement": {
      "type": "object",
      "required": ["id", "roles"],
      "additionalProperties": false,
      "properties": {
        "id": { "type": "string" },
        "label": { "type": "string" },
        "roles": {
          "type": "array",
          "items": {
            "type": "string",
            "enum": [
              "manufacturer",
              "importer",
              "distributor",
              "authorised_representative",
              "steward"
            ]
          }
        },
        "applies_to_classes": {
          "type": "array",
          "items": { "type": "string" }
        },
        "applies_when": { "$ref": "#/$defs/expression" },
        "applies_from": {
          "type": "string",
          "format": "date",
          "description": "In force from this date, compared with the assessment date (ADR 0019)."
        },
        "applies_until": {
          "type": "string",
          "format": "date",
          "description": "No longer in force from this date (exclusive), compared with the assessment date."
        },
        "ref": { "type": "string" }
      }
    },
    "assessmentRoute": {
      "type": "object",
      "required": ["id", "label"],
      "additionalProperties": false,
      "properties": {
        "id": { "type": "string" },
        "label": { "type": "string" },
        "allowed_when": { "$ref": "#/$defs/expression" }
      }
    },
    "findingRule": {
      "type": "object",
      "required": ["id", "level", "when", "message"],
      "additionalProperties": false,
      "properties": {
        "id": { "type": "string" },
        "level": { "type": "string", "enum": ["info", "caution", "action_required"] },
        "when": { "$ref": "#/$defs/expression" },
        "message": { "type": "string" },
        "guidance": {
          "type": "string",
          "description": "What the user should do about the finding, in plain words (ADR 0035)."
        },
        "ref": { "type": "string" }
      }
    },
    "fixture": {
      "type": "object",
      "required": ["id", "answers", "expected"],
      "additionalProperties": false,
      "properties": {
        "id": { "type": "string" },
        "answers": { "type": "object" },
        "as_of": {
          "type": "string",
          "format": "date",
          "description": "Assessment date for calendar-dated requirements; required when expecting requirements."
        },
        "expected": {
          "type": "object",
          "additionalProperties": false,
          "properties": {
            "in_scope": { "type": "boolean" },
            "findings": { "type": "array", "items": { "type": "string" } },
            "classifications": { "type": "array", "items": { "type": "string" } },
            "assessment_routes": { "type": "array", "items": { "type": "string" } },
            "requirements": { "type": "array", "items": { "type": "string" } }
          }
        }
      }
    }
  }
}
